{
  "schemaVersion": 1,
  "id": "ordinary/radiance/rgbe-2x2",
  "caseRevision": 1,
  "title": "Radiance RGBE 2 by 2",
  "description": "Radiance RGBE 2 by 2, written by the transparent generator radiance-rgbe.",
  "domain": "ordinary",
  "format": {
    "family": "radiance-hdr",
    "extensions": ["hdr"],
    "mediaTypes": ["image/vnd.radiance"],
    "features": [
      "axes.xy",
      "compression.rle",
      "format.radiance-hdr",
      "frames.single",
      "image.bit-depth.8",
      "image.color.rgbe",
      "image.sample.float",
      "layout.single-file",
      "purejsimage.reader.radiance-hdr"
    ]
  },
  "layout": {
    "kind": "single-file",
    "entrypoint": "rgbe-2x2.hdr",
    "requiredPaths": ["rgbe-2x2.hdr"]
  },
  "assets": [
    {
      "path": "rgbe-2x2.hdr",
      "role": "primary",
      "storage": "generated",
      "sourceId": "purejsimage-corpus-generated",
      "sourcePath": "recipes/generated/ordinary-radiance-rgbe-2x2.json",
      "bytes": 79,
      "sha256": "debfe22dc41acc7bce67175b6f64c053ae80cbbe2b4ff1bca142a5d6556ea930",
      "mediaType": "image/vnd.radiance"
    }
  ],
  "provenance": {
    "sourceId": "purejsimage-corpus-generated",
    "originalUrl": "https://github.com/a-r-d/purejsimage-corpus",
    "resolvedAt": "2026-08-28T00:00:00.000Z",
    "method": "generated"
  },
  "rights": {
    "spdx": "CC0-1.0",
    "licenseName": "CC0 1.0 Universal",
    "evidenceUrl": "https://creativecommons.org/publicdomain/zero/1.0/",
    "attribution": "Generated by purejsimage-corpus",
    "redistribution": "allowed"
  },
  "privacy": {
    "reviewStatus": "not-required",
    "containsHumanData": false,
    "phi": "none",
    "burnedInText": "none",
    "gps": "none",
    "faces": "none",
    "deidentified": "not-applicable",
    "notes": ["No human-derived medical data."]
  },
  "certification": {
    "status": "generator-reviewed",
    "evidence": []
  },
  "expected": {
    "classification": "valid",
    "outcome": "success",
    "operations": ["metadata", "full-decode"],
    "comparison": {
      "method": "structural"
    },
    "metadata": {},
    "resourceLimits": {
      "timeoutMs": 5000,
      "maxInputBytes": 79,
      "maxDecodedPixels": 100000000,
      "maxFrames": 1000,
      "maxHeapMiB": 512
    }
  },
  "coverage": {
    "features": [
      "axes.xy",
      "compression.rle",
      "format.radiance-hdr",
      "frames.single",
      "image.bit-depth.8",
      "image.color.rgbe",
      "image.sample.float",
      "layout.single-file",
      "purejsimage.reader.radiance-hdr"
    ],
    "selectionReason": "Provides a small independently written radiance-hdr case for radiance-hdr.",
    "priority": "high"
  },
  "notes": ["The generator is independent of PureJsImage codec implementations."]
}
