{
  "schemaVersion": 1,
  "id": "ordinary/migrated/libtiff-miniswhite-1c-1b",
  "caseRevision": 1,
  "title": "libtiff miniswhite 1c 1b",
  "description": "Migrated without changing source bytes from PureJsImage benchmark/corpus/manifest.json.",
  "domain": "ordinary",
  "format": {
    "family": "tiff",
    "extensions": ["tiff"],
    "mediaTypes": ["image/tiff"],
    "features": [
      "axes.xy",
      "compression.unknown",
      "format.tiff",
      "frames.single",
      "image.bit-depth.unknown",
      "image.color.unknown",
      "image.sample.unknown",
      "layout.single-file",
      "purejsimage.reader.tiff"
    ]
  },
  "layout": {
    "kind": "single-file",
    "entrypoint": "libtiff-miniswhite-1c-1b.tiff",
    "requiredPaths": ["libtiff-miniswhite-1c-1b.tiff"]
  },
  "assets": [
    {
      "path": "libtiff-miniswhite-1c-1b.tiff",
      "role": "primary",
      "storage": "external",
      "sourceId": "purejsimage",
      "sourcePath": "libtiff-miniswhite-1c-1b.tiff",
      "resolvedUrl": "https://gitlab.com/libtiff/libtiff/-/raw/v4.7.1/test/images/miniswhite-1c-1b.tiff",
      "bytes": 3289,
      "sha256": "9b303ec8e0dc83e9099af6a8c0d837772caad953d72995ad34e2f842fb66e83f",
      "mediaType": "image/tiff"
    }
  ],
  "provenance": {
    "sourceId": "purejsimage",
    "originalUrl": "https://gitlab.com/libtiff/libtiff/-/raw/v4.7.1/test/images/miniswhite-1c-1b.tiff",
    "resolvedAt": "2026-08-28T00:00:00.000Z",
    "method": "migrated"
  },
  "rights": {
    "licenseName": "libtiff BSD-style license",
    "evidenceUrl": "https://gitlab.com/libtiff/libtiff/-/blob/v4.7.1/test/images/miniswhite-1c-1b.tiff",
    "attribution": "LibTIFF contributors",
    "redistribution": "allowed"
  },
  "privacy": {
    "reviewStatus": "not-required",
    "containsHumanData": false,
    "phi": "none",
    "burnedInText": "none",
    "gps": "none",
    "faces": "none",
    "deidentified": "not-applicable",
    "notes": ["No human-derived medical data."]
  },
  "certification": {
    "status": "uncertified",
    "evidence": []
  },
  "expected": {
    "classification": "valid",
    "outcome": "success",
    "operations": ["metadata", "full-decode"],
    "comparison": {
      "method": "structural"
    },
    "metadata": {
      "width": 157,
      "height": 151
    },
    "resourceLimits": {
      "timeoutMs": 5000,
      "maxInputBytes": 3289,
      "maxDecodedPixels": 100000000,
      "maxFrames": 1000,
      "maxHeapMiB": 512
    }
  },
  "coverage": {
    "features": [
      "axes.xy",
      "compression.unknown",
      "format.tiff",
      "frames.single",
      "image.bit-depth.unknown",
      "image.color.unknown",
      "image.sample.unknown",
      "layout.single-file",
      "purejsimage.reader.tiff"
    ],
    "selectionReason": "Preserves an existing PureJsImage benchmark and regression input.",
    "priority": "medium"
  },
  "notes": ["Original PureJsImage manifest ID: libtiff-miniswhite-1c-1b"]
}
