{
  "schemaVersion": 1,
  "id": "geo/envi/bil-int16",
  "caseRevision": 1,
  "title": "Geo-ENVI BIL companion pair",
  "description": "Geo-ENVI BIL companion pair, written by the transparent generator envi.",
  "domain": "geo",
  "format": {
    "family": "geo-envi",
    "extensions": ["bin", "hdr"],
    "mediaTypes": ["application/octet-stream", "image/vnd.radiance"],
    "features": [
      "axes.xy",
      "companion-files",
      "compression.none",
      "endian.little",
      "format.geo-envi",
      "frames.single",
      "geo.crs",
      "image.bit-depth.16",
      "image.color.multiband",
      "image.sample.signed",
      "interleave.bil",
      "layout.companion-set",
      "purejsimage.reader.geo-envi"
    ]
  },
  "layout": {
    "kind": "companion-set",
    "entrypoint": "tiny-bil.hdr",
    "requiredPaths": ["tiny-bil.bin", "tiny-bil.hdr"]
  },
  "assets": [
    {
      "path": "tiny-bil.hdr",
      "role": "header",
      "storage": "generated",
      "sourceId": "purejsimage-corpus-generated",
      "sourcePath": "recipes/generated/geo-envi-bil-int16.json",
      "bytes": 241,
      "sha256": "53a0eaf335d8c5dfefbfd0566973f27cdc3da2702dbb4812b0298f3b53c25f9d",
      "mediaType": "image/vnd.radiance"
    },
    {
      "path": "tiny-bil.bin",
      "role": "payload",
      "storage": "generated",
      "sourceId": "purejsimage-corpus-generated",
      "sourcePath": "recipes/generated/geo-envi-bil-int16.json",
      "bytes": 24,
      "sha256": "fd91cbf655e16372a588dcc19b2f0db51669420eac7d81f15a1cfb83b48c62e5",
      "mediaType": "application/octet-stream"
    }
  ],
  "provenance": {
    "sourceId": "purejsimage-corpus-generated",
    "originalUrl": "https://github.com/a-r-d/purejsimage-corpus",
    "resolvedAt": "2026-08-28T00:00:00.000Z",
    "method": "generated"
  },
  "rights": {
    "spdx": "CC0-1.0",
    "licenseName": "CC0 1.0 Universal",
    "evidenceUrl": "https://creativecommons.org/publicdomain/zero/1.0/",
    "attribution": "Generated by purejsimage-corpus",
    "redistribution": "allowed"
  },
  "privacy": {
    "reviewStatus": "not-required",
    "containsHumanData": false,
    "phi": "none",
    "burnedInText": "none",
    "gps": "none",
    "faces": "none",
    "deidentified": "not-applicable",
    "notes": ["No human-derived medical data."]
  },
  "certification": {
    "status": "generator-reviewed",
    "evidence": []
  },
  "expected": {
    "classification": "valid",
    "outcome": "success",
    "operations": ["metadata", "full-decode"],
    "comparison": {
      "method": "structural"
    },
    "metadata": {},
    "resourceLimits": {
      "timeoutMs": 5000,
      "maxInputBytes": 265,
      "maxDecodedPixels": 100000000,
      "maxFrames": 1000,
      "maxHeapMiB": 512
    }
  },
  "coverage": {
    "features": [
      "axes.xy",
      "companion-files",
      "compression.none",
      "endian.little",
      "format.geo-envi",
      "frames.single",
      "geo.crs",
      "image.bit-depth.16",
      "image.color.multiband",
      "image.sample.signed",
      "interleave.bil",
      "layout.companion-set",
      "purejsimage.reader.geo-envi"
    ],
    "selectionReason": "Provides a small independently written geo-envi case for geo-envi.",
    "priority": "high"
  },
  "notes": ["The generator is independent of PureJsImage codec implementations."]
}
