{
  "schemaVersion": 1,
  "id": "scientific/digital-micrograph/dm3-test1",
  "caseRevision": 1,
  "title": "DigitalMicrograph DM3 test1",
  "description": "DigitalMicrograph DM3 test1, pinned by SHA-256 and exact upstream revision where available.",
  "domain": "scientific",
  "format": {
    "family": "dm3",
    "extensions": ["dm3"],
    "mediaTypes": ["application/octet-stream"],
    "features": [
      "axes.xy",
      "compression.unknown",
      "format.dm3",
      "frames.single",
      "image.bit-depth.unknown",
      "image.color.unknown",
      "image.sample.unknown",
      "layout.single-file",
      "purejsimage.reader.digital-micrograph"
    ]
  },
  "layout": {
    "kind": "single-file",
    "entrypoint": "test-1.dm3",
    "requiredPaths": ["test-1.dm3"]
  },
  "assets": [
    {
      "path": "test-1.dm3",
      "role": "primary",
      "storage": "external",
      "sourceId": "rosettasciio",
      "sourcePath": "digitalmicrograph/1D/test-1.dm3",
      "resolvedUrl": "https://raw.githubusercontent.com/hyperspy/rosettasciio/bc254db14cd7d4d23169b11aeb622a0a7eac1fbe/rsciio/tests/data/digitalmicrograph/1D/test-1.dm3",
      "bytes": 49475,
      "sha256": "1415584aeadae829aba952c580a9683fefe2772d59d5e222d7ec227d3bb8693e",
      "mediaType": "application/octet-stream"
    }
  ],
  "provenance": {
    "sourceId": "rosettasciio",
    "originalUrl": "https://raw.githubusercontent.com/hyperspy/rosettasciio/bc254db14cd7d4d23169b11aeb622a0a7eac1fbe/rsciio/tests/data/digitalmicrograph/1D/test-1.dm3",
    "resolvedAt": "2026-08-28T00:00:00.000Z",
    "method": "downloaded"
  },
  "rights": {
    "licenseName": "Asset license not established",
    "evidenceUrl": "https://github.com/hyperspy/rosettasciio",
    "attribution": "See upstream source metadata.",
    "redistribution": "unknown"
  },
  "privacy": {
    "reviewStatus": "not-required",
    "containsHumanData": false,
    "phi": "none",
    "burnedInText": "none",
    "gps": "none",
    "faces": "none",
    "deidentified": "not-applicable",
    "notes": ["No human-derived medical data."]
  },
  "certification": {
    "status": "uncertified",
    "evidence": []
  },
  "expected": {
    "classification": "valid",
    "outcome": "success",
    "operations": ["metadata", "full-decode"],
    "comparison": {
      "method": "structural"
    },
    "metadata": {},
    "resourceLimits": {
      "timeoutMs": 5000,
      "maxInputBytes": 49475,
      "maxDecodedPixels": 100000000,
      "maxFrames": 1000,
      "maxHeapMiB": 512
    }
  },
  "coverage": {
    "features": [
      "axes.xy",
      "compression.unknown",
      "format.dm3",
      "frames.single",
      "image.bit-depth.unknown",
      "image.color.unknown",
      "image.sample.unknown",
      "layout.single-file",
      "purejsimage.reader.digital-micrograph"
    ],
    "selectionReason": "Exercises the real digital-micrograph reader with independently hashed upstream bytes.",
    "priority": "high"
  },
  "notes": ["External because asset-level redistribution rights are not established."]
}
