{
  "schemaVersion": 1,
  "id": "ordinary/netpbm/ppm-binary",
  "caseRevision": 1,
  "title": "PPM binary primary colors",
  "description": "PPM binary primary colors, written by the transparent generator ppm-binary.",
  "domain": "ordinary",
  "format": {
    "family": "ppm",
    "extensions": ["ppm"],
    "mediaTypes": ["application/octet-stream"],
    "features": [
      "axes.xy",
      "compression.none",
      "format.ppm",
      "frames.single",
      "image.bit-depth.8",
      "image.color.rgb",
      "image.sample.unsigned",
      "layout.single-file",
      "purejsimage.reader.netpbm"
    ]
  },
  "layout": {
    "kind": "single-file",
    "entrypoint": "rgb-2x2.ppm",
    "requiredPaths": ["rgb-2x2.ppm"]
  },
  "assets": [
    {
      "path": "rgb-2x2.ppm",
      "role": "primary",
      "storage": "generated",
      "sourceId": "purejsimage-corpus-generated",
      "sourcePath": "recipes/generated/ordinary-netpbm-ppm-binary.json",
      "bytes": 23,
      "sha256": "69d84c9c40bbfe1bfa0519120af54a299af34be4eebb31bb6a34b67aaae22f00",
      "mediaType": "application/octet-stream"
    }
  ],
  "provenance": {
    "sourceId": "purejsimage-corpus-generated",
    "originalUrl": "https://github.com/a-r-d/purejsimage-corpus",
    "resolvedAt": "2026-08-28T00:00:00.000Z",
    "method": "generated"
  },
  "rights": {
    "spdx": "CC0-1.0",
    "licenseName": "CC0 1.0 Universal",
    "evidenceUrl": "https://creativecommons.org/publicdomain/zero/1.0/",
    "attribution": "Generated by purejsimage-corpus",
    "redistribution": "allowed"
  },
  "privacy": {
    "reviewStatus": "not-required",
    "containsHumanData": false,
    "phi": "none",
    "burnedInText": "none",
    "gps": "none",
    "faces": "none",
    "deidentified": "not-applicable",
    "notes": ["No human-derived medical data."]
  },
  "certification": {
    "status": "generator-reviewed",
    "evidence": []
  },
  "expected": {
    "classification": "valid",
    "outcome": "success",
    "operations": ["metadata", "full-decode"],
    "comparison": {
      "method": "structural"
    },
    "metadata": {},
    "resourceLimits": {
      "timeoutMs": 5000,
      "maxInputBytes": 23,
      "maxDecodedPixels": 100000000,
      "maxFrames": 1000,
      "maxHeapMiB": 512
    }
  },
  "coverage": {
    "features": [
      "axes.xy",
      "compression.none",
      "format.ppm",
      "frames.single",
      "image.bit-depth.8",
      "image.color.rgb",
      "image.sample.unsigned",
      "layout.single-file",
      "purejsimage.reader.netpbm"
    ],
    "selectionReason": "Provides a small independently written ppm case for netpbm.",
    "priority": "high"
  },
  "notes": ["The generator is independent of PureJsImage codec implementations."]
}
