{
  "schemaVersion": 1,
  "id": "scientific/nifti/nifti-2-int16",
  "caseRevision": 1,
  "title": "NIfTI-2 single-file int16",
  "description": "NIfTI-2 single-file int16, written by the transparent generator nifti.",
  "domain": "scientific",
  "format": {
    "family": "nifti",
    "extensions": ["nii"],
    "mediaTypes": ["application/octet-stream"],
    "features": [
      "axes.xy",
      "axes.xyz",
      "compression.none",
      "endian.little",
      "format.nifti",
      "frames.single",
      "image.bit-depth.16",
      "image.color.gray",
      "image.sample.signed",
      "layout.single-file",
      "purejsimage.reader.nifti"
    ]
  },
  "layout": {
    "kind": "single-file",
    "entrypoint": "nifti-2.nii",
    "requiredPaths": ["nifti-2.nii"]
  },
  "assets": [
    {
      "path": "nifti-2.nii",
      "role": "primary",
      "storage": "generated",
      "sourceId": "purejsimage-corpus-generated",
      "sourcePath": "recipes/generated/scientific-nifti-nifti-2-int16.json",
      "bytes": 556,
      "sha256": "f3296a4c9d0103e6811b8bf6d72d6eae54c5ee13d3260d92f8ade573676dafa6",
      "mediaType": "application/octet-stream"
    }
  ],
  "provenance": {
    "sourceId": "purejsimage-corpus-generated",
    "originalUrl": "https://github.com/a-r-d/purejsimage-corpus",
    "resolvedAt": "2026-08-28T00:00:00.000Z",
    "method": "generated"
  },
  "rights": {
    "spdx": "CC0-1.0",
    "licenseName": "CC0 1.0 Universal",
    "evidenceUrl": "https://creativecommons.org/publicdomain/zero/1.0/",
    "attribution": "Generated by purejsimage-corpus",
    "redistribution": "allowed"
  },
  "privacy": {
    "reviewStatus": "not-required",
    "containsHumanData": false,
    "phi": "none",
    "burnedInText": "none",
    "gps": "none",
    "faces": "none",
    "deidentified": "not-applicable",
    "notes": ["No human-derived medical data."]
  },
  "certification": {
    "status": "generator-reviewed",
    "evidence": []
  },
  "expected": {
    "classification": "valid",
    "outcome": "success",
    "operations": ["metadata", "full-decode"],
    "comparison": {
      "method": "structural"
    },
    "metadata": {},
    "resourceLimits": {
      "timeoutMs": 5000,
      "maxInputBytes": 556,
      "maxDecodedPixels": 100000000,
      "maxFrames": 1000,
      "maxHeapMiB": 512
    }
  },
  "coverage": {
    "features": [
      "axes.xy",
      "axes.xyz",
      "compression.none",
      "endian.little",
      "format.nifti",
      "frames.single",
      "image.bit-depth.16",
      "image.color.gray",
      "image.sample.signed",
      "layout.single-file",
      "purejsimage.reader.nifti"
    ],
    "selectionReason": "Provides a small independently written nifti case for nifti.",
    "priority": "high"
  },
  "notes": ["The generator is independent of PureJsImage codec implementations."]
}
