{
  "schemaVersion": 1,
  "id": "ordinary/migrated/wpt-webcodecs-mozjpeg-yuv420",
  "caseRevision": 1,
  "title": "wpt webcodecs mozjpeg yuv420",
  "description": "Migrated without changing source bytes from PureJsImage benchmark/corpus/manifest.json.",
  "domain": "ordinary",
  "format": {
    "family": "jpeg",
    "extensions": ["jpg"],
    "mediaTypes": ["application/octet-stream"],
    "features": [
      "axes.xy",
      "compression.unknown",
      "format.jpeg",
      "frames.single",
      "image.bit-depth.unknown",
      "image.color.unknown",
      "image.sample.unknown",
      "layout.single-file",
      "purejsimage.reader.jpeg"
    ]
  },
  "layout": {
    "kind": "single-file",
    "entrypoint": "wpt-webcodecs-mozjpeg-yuv420.jpg",
    "requiredPaths": ["wpt-webcodecs-mozjpeg-yuv420.jpg"]
  },
  "assets": [
    {
      "path": "wpt-webcodecs-mozjpeg-yuv420.jpg",
      "role": "primary",
      "storage": "external",
      "sourceId": "purejsimage",
      "sourcePath": "wpt-webcodecs-mozjpeg-yuv420.jpg",
      "resolvedUrl": "https://raw.githubusercontent.com/web-platform-tests/wpt/5f8cfdc18b18b1619c9fe431eab72f2831823327/webcodecs/four-colors-limited-range-420-8bpc.jpg",
      "bytes": 1006,
      "sha256": "226671d7fcd032a237d7e195e936545f0b492628fd96b21e1b062ccbc40e2a6e",
      "mediaType": "application/octet-stream"
    }
  ],
  "provenance": {
    "sourceId": "purejsimage",
    "originalUrl": "https://raw.githubusercontent.com/web-platform-tests/wpt/master/webcodecs/four-colors-limited-range-420-8bpc.jpg",
    "resolvedAt": "2026-08-28T00:00:00.000Z",
    "method": "migrated"
  },
  "rights": {
    "licenseName": "BSD 3-Clause",
    "evidenceUrl": "https://github.com/web-platform-tests/wpt/blob/master/webcodecs/README.md",
    "attribution": "web-platform-tests contributors; generated with Squoosh MozJPEG",
    "redistribution": "allowed"
  },
  "privacy": {
    "reviewStatus": "not-required",
    "containsHumanData": false,
    "phi": "none",
    "burnedInText": "none",
    "gps": "none",
    "faces": "none",
    "deidentified": "not-applicable",
    "notes": ["No human-derived medical data."]
  },
  "certification": {
    "status": "uncertified",
    "evidence": []
  },
  "expected": {
    "classification": "valid",
    "outcome": "success",
    "operations": ["metadata", "full-decode"],
    "comparison": {
      "method": "structural"
    },
    "metadata": {
      "width": 320,
      "height": 240,
      "orientation": 1
    },
    "resourceLimits": {
      "timeoutMs": 5000,
      "maxInputBytes": 1006,
      "maxDecodedPixels": 100000000,
      "maxFrames": 1000,
      "maxHeapMiB": 512
    }
  },
  "coverage": {
    "features": [
      "axes.xy",
      "compression.unknown",
      "format.jpeg",
      "frames.single",
      "image.bit-depth.unknown",
      "image.color.unknown",
      "image.sample.unknown",
      "layout.single-file",
      "purejsimage.reader.jpeg"
    ],
    "selectionReason": "Preserves an existing PureJsImage benchmark and regression input.",
    "priority": "medium"
  },
  "notes": ["Original PureJsImage manifest ID: wpt-webcodecs-mozjpeg-yuv420"]
}
